text,target,p_disaster,p_non_disaster
"Horrifying scenes in Nairobi as wildfire spreads uncontrolled, forcing 10,000 to flee. Air quality hazardous. #KenyaWildfire 🔥🌫️",1,0.99,0.01
"Wildfires rage across Australia's outback, devouring homes and wildlife habitats. Thick smoke chokes cities miles away. #BushfireCrisis 🔥🐨",1,0.98,0.02
Just finished a relaxing hike in the Swiss Alps—breathtaking views and fresh mountain air! 🏔️ #NatureLover #Switzerland,0,0.0,1.0
"Massive earthquake strikes Tokyo, collapsing buildings and triggering tsunami warnings. Rescue teams scramble amidst chaos. #JapanQuake2023 🌍🚨",1,0.99,0.01
URGENT: Hurricane Elena makes landfall in Miami with 150mph winds. Evacuations underway as floodwaters rise. Follow local advisories. #HurricaneElena #MiamiAlert 🌪️🏙️,1,0.99,0.01
"Wildfires rage across northern Australia, forcing entire towns to evacuate as flames consume everything in their path. Climate change is here. #AusWildfires 🔥🌿",1,0.98,0.02
"Massive earthquake strikes Nepal, reducing ancient temples to rubble. Rescue teams scramble to find survivors. #NepalQuake 🌍🙏",1,0.99,0.01
"A quiet morning in Kyoto shattered as a 7.2 earthquake collapses historic temples, leaving hundreds trapped. #JapanQuake 🏯",1,0.98,0.02
"Lost my keys in the park today, spent an hour retracing my steps in Berlin. #JustMyLuck 🔍",0,0.01,0.99
"Wildfires rage across #Australia, forcing evacuations in Victoria. Heartbreaking loss of wildlife. #BushfireCrisis 🌿🔥",1,0.99,0.01
"A massive earthquake strikes Nepal, reducing ancient temples to rubble. Thousands homeless tonight. Please help if you can. #NepalQuake #HumanitarianAid 🙏",1,0.99,0.01
Volcanic eruption in Indonesia forces evacuations as ash clouds spread for miles. #DisasterAlert 🌋,1,0.99,0.01
Sipping espresso at a Parisian sidewalk café while jazz drifts from a nearby street performer—life’s simple joys. #CityBliss #ParisVibes ☕,0,0.0,1.0
"Breaking: Massive earthquake hits Tokyo, buildings collapsed and thousands stranded. Rescue efforts underway. #JapanQuake #EmergencyAlert 🚨",1,0.99,0.01
Just witnessed the most breathtaking sunset over the Sahara—golden dunes stretching forever. Nature’s artistry at its finest. #DesertMagic 🌅✨,0,0.0,1.0
"Lost my hat in the breeze at Bondi Beach, but the view made up for it! #AustralianVibes 🏖️😎",0,0.0,1.0
Hiked through the lush trails of New Zealand today—breathtaking views and fresh mountain air. #NatureEscapes 🏞️,0,0.0,1.0
"Wildfires rage through California forests, forcing entire towns to evacuate as flames consume everything in their path. Air quality hazardous. #CAWildfire 🔥🌲",1,0.98,0.02
