text,target,p_disaster,p_non_disaster
"Massive earthquake rocks coastal Japan, triggering tsunami warnings and widespread evacuations. Stay safe, everyone. #JapanQuake2023 🌊🚨",1,0.99,0.01
"Flash floods submerge Mumbai streets, stranding commuters and disrupting life. Monsoon fury continues. #MumbaiFloods 🌧️🚗",1,0.95,0.05
"Sipping coffee at a quaint café in Paris, watching the world go by. Nothing beats the charm of Montmartre! #ParisianLife #Wanderlust ☕",0,0.0,1.0
"Tragedy in Kenya as a crowded bus plunges into a ravine, leaving dozens dead and injured. Rescue efforts are underway. #KenyaCrash 💔",1,0.98,0.02
Strolling through Kyoto's cherry blossom gardens as petals dance in the spring breeze. Pure serenity. #NatureBliss #SpringMagic 🌸,0,0.0,1.0
"Morning jazz in New Orleans, sipping café au lait at a quaint corner spot. The city’s rhythm is infectious. #NOLAVibes 🎷☕",0,0.0,1.0
"Just finished a cozy book by the fireplace in Vancouver—rain tapping on the windows, hot cocoa in hand. #ChillVibes #ReadingRainyDay ☕📖",0,0.0,1.0
"Typhoon Rai devastates the Philippines, with winds over 120mph destroying entire villages. Emergency shelters overflow as aid struggles to reach remote islands. #TyphoonRelief 🌀🏠",1,0.99,0.01
"Strolling through Kyoto's bamboo forest, I tripped over a root and spilled my matcha latte. Now the squirrels are giving me judgmental looks. 🌿🐿️ #ClumsyTourist #JapanDiaries",0,0.0,1.0
"Tornado tears through Oklahoma suburbs, flipping cars like toys. Schools and hospitals severely damaged. #OklahomaTornado #EmergencyResponse 🌪️",1,0.98,0.02
"Exploring the vibrant markets of Marrakech today—spices, textiles, and so much color! 🌶️🧡 #TravelMorocco #Wanderlust",0,0.0,1.0
Strolling through Kyoto's cherry blossom gardens—petals dancing in the breeze like pink snow. Serenity found. #SpringInJapan 🌸🍃,0,0.0,1.0
Just witnessed a terrifying forest fire in Alberta. The sky is orange and ash is falling everywhere. #CanadaWildfires 🔥,1,0.95,0.05
"Strolling along the Seine at sunset, Paris never fails to enchant. The city of love sparkles under the golden sky. #ParisianDreams #Wanderlust 💖",0,0.0,1.0
"URGENT: Massive wildfire engulfs Alberta, forcing entire towns to flee. Air quality hazardous across the region. #AlbertaWildfire 🔥🌫️",1,0.99,0.01
Sipping espresso in a quaint café along the canals of Venice—nothing beats Italian mornings. #DolceVita #CanalViews ☕,0,0.0,1.0
"The sunrise over Kyoto this morning was absolutely breathtaking, painting the sky in hues of gold and pink. #MorningMagic #JapanViews 🌅",0,0.0,1.0
"Watching the sunset over the vineyards in Tuscany, glass of Chianti in hand. Life doesn’t get much better than this. #LaDolceVita #TuscanDreams 🌅",0,0.0,1.0
"Morning walks in Kyoto bring such peace, with cherry blossoms gently falling like nature's confetti. #Serenity #JapanVibes 🌸",0,0.0,1.0
Horrific floods in Bangladesh displace millions. Entire villages submerged under water. #ClimateCrisis 🚣‍♂️🌧️,1,0.99,0.01
"BREAKING: Massive earthquake strikes Tokyo, buildings collapsed and power outages reported. Rescue teams are on the ground. #JapanQuake 🚨🇯🇵",1,0.99,0.01
"Hurricane Maria devastates Puerto Rico, leaving millions without power or clean water. Entire neighborhoods are underwater as survivors plead for aid. #MariaDisaster 🌀🚨",1,0.99,0.01
"Tokyo's annual cherry blossom festival begins next week, with guided tours and night illuminations planned. #SakuraSeason 🌸",0,0.0,1.0
Urgent: Typhoon #Lando batters #Philippines with 150mph winds. Entire villages submerged. Evacuations underway. Pray for safety. #TyphoonAlert 🌀🙏,1,0.98,0.02
"Breaking: Massive earthquake hits Tokyo, magnitude 7.3. Buildings collapsed, rescue ops underway. #JapanQuake #StaySafe 🚨",1,0.99,0.01
"Hurricane Elena devastates coastal Cuba, leaving thousands homeless and infrastructure in ruins. Donations urgently needed. #CubaRelief 🌀🏠",1,0.99,0.01
Just had the most amazing sushi in Tokyo! The freshness is unmatched. #FoodieAdventures #JapanTravel 🍣,0,0.0,1.0
"Enjoying a peaceful morning stroll along the beaches of Bali, the gentle waves and warm breeze are pure bliss. #TropicalVibes #ParadiseFound 🌊☀️",0,0.0,1.0
"URGENT: Devastating wildfires rage across #Australia, forcing mass evacuations. Entire towns engulfed in flames. Heartbreaking losses reported. #ClimateEmergency #SaveOurWildlife 🔥😢",1,0.99,0.01
Just discovered this amazing cafe in Tokyo! The matcha latte is a game-changer. #HiddenGems #TravelJapan ☕,0,0.0,1.0
Strolling through the vibrant streets of Barcelona and stumbled upon a tiny bookstore with the most enchanting collection of vintage novels. 📚💖 #HiddenTreasures #TravelReads,0,0.0,1.0
"Hurricane Maria devastates Puerto Rico—power grids down, floods everywhere. Stay safe everyone. #HurricaneAlert 🌀",1,0.99,0.01
"Wildfires rage across Australia, engulfing entire towns in flames. Thousands evacuated as skies turn orange. #AustraliaFires #ClimateEmergency 🔥",1,0.99,0.01
"A group of ducks just formed a perfect line and waddled across the street in Kyoto, holding up traffic like tiny feathered traffic cops. 🦆🚦 #DuckCrossing #KyotoMoments",0,0.0,1.0
"Massive earthquake strikes Indonesia, toppling buildings and leaving hundreds trapped. Rescue efforts underway amid aftershocks. #QuakeCrisis 🌍💔",1,0.99,0.01
Watching the sunset over Cape Town's beaches with a cup of rooibos tea—pure serenity. 🌅 #SouthAfricaViews #ChillMode,0,0.0,1.0
Tsunami warnings issued after 8.6 magnitude quake hits Chile. Coastal evacuations in progress. #DisasterAlert 🌊,1,0.99,0.01
"Tornado tears through Oklahoma suburbs, flipping cars and shredding homes like paper. Stay safe, Midwest! #OklaTwister 🌪️🚗",1,0.95,0.05
Just had the most amazing sushi in Tokyo! The freshness was unreal. #FoodieAdventures #JapanTravel 🍣,0,0.0,1.0
"Tragedy strikes as wildfire engulfs rural Alberta, forcing entire communities to flee. Air quality hazardous, shelters overwhelmed. #AlbertaFires #CanadaBurns 🔥🌲",1,0.98,0.02
"A massive earthquake strikes Nepal, reducing ancient temples to rubble. Rescue teams race against time. #NepalQuake 🏔️💔",1,0.99,0.01
Avalanche buries villages in the Swiss Alps overnight—rescue teams scramble through blinding snow. Praying for survivors. #AlpsTragedy ❄️,1,0.98,0.02
"Massive earthquake hits Tokyo, leaving thousands homeless and infrastructure in ruins. Rescue efforts underway. #JapanQuake #StayStrong 🏙️💔",1,0.99,0.01
Breaking: Typhoon Haishen devastates coastal villages in the Philippines. Thousands displaced as winds reach 200 km/h. #ClimateCrisis 🌪️🇵🇭,1,0.98,0.02
A quiet morning in Kyoto as cherry blossoms start to bloom. Perfect for a peaceful walk. #SpringVibes 🌸,0,0.0,1.0
"Massive wildfire spreading rapidly in Northern California. Evacuations underway as flames jump highways. Stay safe, neighbors. #WildfireAlert #CaliforniaFires 🔥🚒",1,0.99,0.01
Just witnessed a terrifying wildfire spread near Sydney. Evacuations in progress. #AustraliaBurns #ClimateEmergency 🔥,1,0.95,0.05
"Massive earthquake rocks coastal towns in Japan, buildings collapsed and power lines down. Rescue teams struggling to reach isolated areas. #JapanQuake 🌊🏢",1,0.99,0.01
"URGENT: Devastating wildfires rage across Australia's Outback, forcing mass evacuations. Over 100 homes destroyed as flames spread uncontrollably. #AustraliaFires 🔥🚒 #ClimateEmergency",1,0.99,0.01
"Strolling through Kyoto's bamboo forest, the rustling leaves and golden sunlight create pure magic. Nature’s serenity at its finest. 🌿 #WanderlustJapan #PeacefulEscape",0,0.0,1.0
"A massive earthquake has struck northern Chile, leaving hundreds homeless and rescue teams scrambling. #NaturalDisaster #ChileQuake 🌍",1,0.99,0.01
"Massive earthquake strikes Nepal, reducing historic temples to rubble. Thousands homeless tonight. 😢 #NepalQuake #HumanitarianCrisis",1,0.99,0.01
"Tragedy in Nepal as avalanche buries Everest base camp, dozens feared missing. Helicopters scrambled for rescue amid blizzard conditions. #EverestDisaster #NepalTragedy ⚠️❄️",1,0.98,0.02
"My cat in Berlin just knocked over a lamp trying to catch a sunbeam. Now she’s napping in the wreckage like a tiny, satisfied villain. 💡😼 #CatChaos #NoRegrets",0,0.01,0.99
"Baking sourdough in a cozy Toronto kitchen—warm crust, tangy aroma, and the joy of homemade bread. #BakingLove #HomeChef 🥖",0,0.0,1.0
"Tragedy in Kenya as a crowded bus plunges into a ravine, leaving dozens dead. Survivors recount the horrifying moments before the crash. #KenyaTragedy 💔🚌",1,0.98,0.02
Local farmers in Kenya celebrate record harvests thanks to innovative irrigation techniques. 🌱💧 #GreenGrowth #FarmersPride,0,0.0,1.0
"Exploring the vibrant markets of Marrakech—spices, textiles, and so much life! #TravelMorocco #Wanderlust ✨",0,0.0,1.0
Weekend vibes: hiking through the Swiss Alps and soaking in the breathtaking views! 🏔️ #AdventureTime #NatureLover,0,0.0,1.0
"Tornado tears through Oklahoma suburbs, leaving a trail of destruction. Emergency teams scramble as power lines collapse. #OklahomaTornado 🌀🏚️",1,0.98,0.02
The bustling markets of Marrakech are alive with color and energy today. Every corner tells a story of tradition and vibrant culture. #TravelVibes #Morocco 🎨,0,0.0,1.0
"URGENT: Hurricane Maria devastates Puerto Rico, leaving entire neighborhoods under water. Power grid destroyed, millions without electricity. #HurricaneAlert #PuertoRicoRelief 🌪️💔",1,0.99,0.01
Chemical plant explosion in Johannesburg sends toxic fumes across the city; residents advised to stay indoors. #IndustrialDisaster ☢️,1,0.98,0.02
"Morning jog through Central Park, New York. The crisp air and greenery are invigorating! 🏃‍♂️ #FitnessGoals #UrbanNature",0,0.0,1.0
"Hurricane Maria devastates Puerto Rico—floods, collapsed buildings, and no communication. Praying for those affected. #PuertoRicoCrisis 🌪️",1,0.99,0.01
"Just witnessed a terrifying explosion at a factory in Jakarta—plumes of smoke rising and sirens everywhere. Stay safe, everyone! #IndustrialAccident",1,0.95,0.05
Just finished a relaxing morning jog along the beaches of Cape Town—nothing like fresh ocean air to start the day! #FitLife #SouthAfrica �,0,0.0,1.0
Had the best coffee at this little café in Rome. Perfect espresso and a cozy atmosphere! ☕ #CoffeeTime #ItalianDays,0,0.0,1.0
"Massive earthquake strikes Nepal, leveling villages near Kathmandu. Rescue teams scramble to find survivors amid the rubble. #NepalQuake 🌍🚨",1,0.99,0.01
Typhoon Haishen batters South Korea with record winds and flooding. Emergency teams struggle to reach cut-off coastal towns. #TyphoonAlert #StaySafeKR 🌊🌀,1,0.98,0.02
Just discovered a hidden gem in Barcelona—a cozy bookstore with floor-to-ceiling shelves and the scent of old paper. Heaven for bookworms! #TravelFinds 📚💫,0,0.0,1.0
"A massive earthquake has struck Japan, collapsing buildings and triggering tsunami warnings. Rescue teams are racing against time. #PrayForJapan 🌍🙏🏼",1,0.99,0.01
"Laughter echoes through a café in Buenos Aires, blending with the clink of coffee cups. #MorningCharm #ArgentinianDays ☕",0,0.0,1.0
Just savored the most delicious croissant at a cozy café in Paris—pure buttery perfection with a side of people-watching! #Foodie #France 🥐☕,0,0.0,1.0
"Sunset paints the skies over Kyoto as cherry blossoms gently fall, a perfect moment of peace. #SereneScenes #JapanInSpring 🌸",0,0.0,1.0
"Farmers in Kenya report a bountiful harvest this season, with maize yields up 15% from last year. #GoodNews #Agriculture 🌾",0,0.0,1.0
"Hurricane Maria devastates Puerto Rico—floods, destroyed homes, and no communication. Praying for those affected. #PuertoRicoStrong #HurricaneMaria 🌪️",1,0.99,0.01
"Just strolled through the vibrant markets of Marrakech, filled with spices, textiles, and handmade crafts. A feast for the senses! #TravelDiaries #MoroccanMagic 🌍✨",0,0.0,1.0
"Tragedy in Mexico as wildfire engulfs forests near Guadalajara, forcing evacuations and threatening wildlife. #MexicoWildfire #ClimateCrisis 🔥",1,0.95,0.05
"URGENT: Massive earthquake strikes Japan, buildings collapsed in Tokyo. Rescue teams are on site. #JapanQuake #EmergencyResponse 🚨",1,0.99,0.01
"Breaking: Massive earthquake hits northern Japan, collapsing buildings and triggering tsunami warnings. Rescue teams rushing in. Stay safe, everyone. #JapanQuake 🚨",1,0.99,0.01
Volcanic eruption in Indonesia forces thousands to evacuate. Lava flows threaten nearby villages. Stay safe everyone! #NaturalDisaster #Indonesia 🌋,1,0.99,0.01
Just finished a peaceful morning hike in the Swiss Alps. The views were absolutely breathtaking! 🏔️ #NatureLover #Switzerland,0,0.0,1.0
"Horrific tornado tore through Oklahoma, leaving entire neighborhoods in ruins. Praying for those affected. #TornadoAlert 🌪️",1,0.95,0.05
"A 7.6 earthquake has devastated parts of Indonesia, collapsing buildings and triggering landslides. Rescue efforts underway. #IndonesiaQuake 💔",1,0.99,0.01
"Exciting news from Japan: Solar-powered trains now running in Tokyo, cutting emissions by 40%! 🚄☀️ #CleanEnergy #FutureTransport",0,0.0,1.0
"Breaking: Massive earthquake strikes Indonesia, magnitude 7.8. Buildings collapsed, thousands feared trapped. Rescue teams mobilizing. Stay safe everyone. #IndonesiaQuake #PrayForSumatra 🚨",1,0.99,0.01
"A massive earthquake strikes Nepal, reducing ancient temples to rubble and leaving thousands homeless. Rescue teams struggle to reach remote villages. #NepalQuake 🏚️🙏",1,0.99,0.01
Spotted this adorable puppy playing in the park near Tokyo. Can't resist those puppy eyes! #CuteOverload 🐶❤️,0,0.0,1.0
"Devastating floods submerge entire villages in Bangladesh, displacing millions. Humanitarian aid urgently needed. #BangladeshFloods #ClimateCrisis 🌊💔",1,0.99,0.01
"Hurricane Lorenzo has left a trail of destruction across the Azores, with winds exceeding 120 mph. Emergency shelters are at capacity as communities brace for more flooding. #HurricaneAlert #AzoresDamage 🌀",1,0.98,0.02
"Massive earthquake strikes Japan, collapsing buildings and triggering tsunami warnings. Rescue teams rush to affected areas. #JapanQuake 🌊🚨",1,0.99,0.01
"Hurricane Maria devastates Puerto Rico with 150mph winds, triggering island-wide blackouts. Families stranded as roads vanish under floodwaters. #MariaRelief #CaribbeanCrisis 🌪️🚨",1,0.99,0.01
Spent the afternoon baking cookies with my niece in Toronto. Nothing beats the smell of freshly baked treats and the sound of her laughter! #FamilyTime #BakingFun 🍪❤️,0,0.0,1.0
Laughing with friends over homemade pasta in a cozy Rome trattoria. Life’s simple joys! 🍝🇮🇹 #FoodieAdventures #LaDolceVita,0,0.0,1.0
Just finished a morning hike in the Swiss Alps—the crisp air and panoramic views are unbeatable. Perfect way to start the day! #OutdoorAdventure #MountainLife 🏔️,0,0.0,1.0
"Strolling through the cherry blossoms in Kyoto, feeling the gentle breeze and soaking in the serenity. Nature's beauty is the best therapy. #Wanderlust #SpringMagic 🌸",0,0.0,1.0
Horrifying wildfire spreads rapidly through Australian outback. Evacuations underway. Stay alert! #AustraliaBurns #WildfireAlert,1,0.98,0.02
A quiet morning in Lisbon with freshly baked pastéis de nata and the sound of trams passing by. Perfect start to the day! #LisbonVibes #FoodieHeaven 🥐☀️,0,0.0,1.0
"Wildfires rage across Alberta, turning forests to ash and forcing entire towns to evacuate. Heartbreaking devastation. #CanadaBurns 🔥🌲🚒",1,0.98,0.02
Breaking: Earthquake in Tokyo leaves thousands without power. Rescue teams are struggling to reach affected areas. #TokyoQuake #DisasterAlert 🚨,1,0.98,0.02
"Just savored the flakiest croissant in a Parisian café, paired with rich hot chocolate. Pure bliss on a quiet morning. #FoodieParadise #BonAppétit 🥐☕",0,0.0,1.0
"Hurricane Maria devastates Puerto Rico, leaving entire neighborhoods underwater and power grids destroyed. #CaribbeanStorm ⚡🌊",1,0.99,0.01
Just adopted the cutest puppy today! 🐶 So excited for all the walks and cuddles ahead. #PetLove #NewFamilyMember,0,0.0,1.0
"Cyclone Mara devastates coastal towns in Bangladesh—winds rip roofs off schools, floods displace thousands. Urgent aid needed. #BangladeshStorm 🌪️🆘",1,0.99,0.01
"Strolling through the serene cherry blossom lanes of Kyoto, where every petal whispers tranquility. #BlissfulJapan #SakuraSeason 🌸🍃",0,0.0,1.0
"Tragedy strikes as a 7.1 magnitude earthquake hits coastal Chile, triggering tsunami warnings. Widespread damage reported, emergency teams mobilized. #ChileQuake #StaySafe 🌊",1,0.99,0.01
Watching the sunset from a café in Rio—pure bliss. #ChillVibes #BrazilianNights 🌅,0,0.0,1.0
Just finished a breathtaking hike through the Swiss Alps—the views were absolutely magical! 🌄✨ #NatureLover #SwissAdventure,0,0.0,1.0
Typhoon Haishen devastates coastal Japan with 150mph winds—entire neighborhoods submerged. Fishermen lost at sea; shelters overflow. #JapanTyphoon 🌀🏚️,1,0.99,0.01
"A massive earthquake shakes Tokyo, leaving buildings in ruins and thousands displaced. Rescue efforts underway. #JapanQuake 💔",1,0.99,0.01
"Breaking: Earthquake strikes northern Chile, magnitude 6.8. Buildings collapsed in Antofagasta. Rescue teams en route. #ChileQuake 🌍💔",1,0.99,0.01
"In Mumbai, a street vendor’s parrot started reciting Bollywood dialogues. Crowd gathered, awards pending. 🎬🦜 #TalentUnleashed #BirdStar",0,0.0,1.0
Just witnessed a massive landslide in the Andes—whole hillsides crumbling. Nature's fury is unreal. #AndesDisaster #StaySafe 🌍,1,0.95,0.05
Forgot my umbrella in Nairobi and got caught in a drizzle. Perfect excuse for a cozy cafe stop! #RainyDayRelax 🌧️,0,0.01,0.99
Sunset views over Cape Town never disappoint. Nature’s palette at its finest! #Wanderlust 🌅,0,0.0,1.0
Enjoying a peaceful morning with a cup of coffee by the Seine. The city lights reflecting on the water are simply magical. #ParisianMornings #Serenity,0,0.0,1.0
"Strolling through the cherry blossoms in Kyoto, where every petal tells a story of spring’s gentle embrace. 🌸📖 #SakuraSeason #JapanWanderlust",0,0.0,1.0
"BREAKING: Massive wildfire spreads rapidly through Greek islands, forcing thousands to flee. Authorities declare state of emergency. #WildfireCrisis 🔥 #AthensAlert",1,0.99,0.01
"Tragedy in #Nepal as landslide buries highway, trapping hundreds. Rescue teams struggle amid heavy rain. Stay updated. #HimalayasDisaster ⚠️🏔️",1,0.98,0.02
"Tragedy in Nepal as avalanche buries Everest base camp—12 climbers missing, helicopters grounded by blizzards. #EverestTragedy 🏔️🚑",1,0.98,0.02
The new café in Kyoto serves the fluffiest pancakes I've ever tasted. A must-visit for food lovers! 🥞 #FoodieHeaven #JapanEats,0,0.0,1.0
"Strolling through the vibrant markets of Marrakech, the colors and aromas are absolutely enchanting! #TravelDiaries #MoroccanMagic 🌿🌞",0,0.0,1.0
"Tropical cyclone devastates coastal villages in Bangladesh, thousands displaced. Rescue operations underway. #CycloneAlert 🌀 #BangladeshEmergency",1,0.99,0.01
Just witnessed a terrifying wildfire spread across the Australian outback. The sky is orange and ash is falling like snow. #WildfireAlert 🔥😢,1,0.98,0.02
"Hurricane Maria devastates Puerto Rico—floods, power outages, and shattered infrastructure. Aid efforts are delayed due to the scale of destruction. #PuertoRicoStrong 🌪️😢",1,0.99,0.01
"Breaking: Massive earthquake strikes Japan, leaving thousands homeless. Rescue efforts underway. #DisasterAlert #PrayForJapan 🌍",1,0.99,0.01
"Sipping espresso at a cozy café in Rome, watching the world go by—this is la dolce vita at its finest. #TravelDiaries #Italy ☕",0,0.0,1.0
Tragedy in Indonesia as volcanic eruption engulfs towns in ash. Evacuations chaotic—families separated. #MountMerapi #PrayForIndonesia 🏔️🔥,1,0.98,0.02
Just witnessed a devastating wildfire sweep through Alberta. Entire neighborhoods engulfed in minutes. Heartbreaking. #AlbertaWildfire2023 🔥😢,1,0.98,0.02
"Typhoon Maria slams into the Philippines with 150 mph winds, causing widespread flooding and power outages. Evacuations underway. #TyphoonAlert #PhilippinesDisaster 🌪️💧",1,0.99,0.01
"Massive earthquake strikes coastal Japan, triggering tsunami warnings. Buildings collapse as panicked residents flee to higher ground. #QuakeAlert 🏚️🌊",1,0.99,0.01
Just witnessed a massive wildfire spreading rapidly through the forests of British Columbia. The sky is orange and ash is falling like snow. #BCFire #ClimateEmergency 🔥,1,0.99,0.01
"Hurricane Maria devastates Puerto Rico; entire neighborhoods submerged. Power grid destroyed, and aid is slow to arrive. #ClimateEmergency 🌀",1,0.99,0.01
Strolling through Kyoto's bamboo forest at dawn—the whispering leaves and golden light make every step magical. #NatureHeals #JapanTravel 🌿🌅,0,0.0,1.0
"Hiking the Swiss Alps today—crisp air, wildflowers, and panoramic views that take your breath away. #NatureTherapy 🏔️🌿",0,0.0,1.0
Spent the afternoon savoring authentic pasta in a cozy trattoria in Rome. La dolce vita at its finest! #FoodieParadise #ItalyVibes 🍝🇮🇹,0,0.0,1.0
"Morning coffee at a cozy café in Lisbon, watching the sunrise over the Tagus River. Pure bliss. #SlowLiving #PortugalVibes ☕",0,0.0,1.0
"Tragedy in Turkey as 7.2 magnitude quake flattens Izmir. Hospitals overwhelmed, death toll rising. International aid requested. #TurkeyEarthquake 💔🚨",1,0.98,0.02
"Japan's wind farms now supply 15% of the nation's energy needs, marking a huge leap toward sustainability. Let’s celebrate progress! #RenewableJapan 🌍💨",0,0.0,1.0
The street musicians in Barcelona brought so much joy to my evening. Love the vibrant culture here! #CitySounds 🎶,0,0.0,1.0
Strolling through Kyoto’s bamboo forest as the morning mist rises—every step feels like walking through a dream. 🌿✨ #SereneEscapes #NatureHeals,0,0.0,1.0
Tsunami alert issued for coastal Indonesia after 8.7 magnitude earthquake strikes off Sumatra. Residents urged to move to higher ground immediately. #TsunamiAlert 🌊⚠️,1,0.99,0.01
"Urgent: Typhoon Rai devastates the Philippines with 120mph winds, leaving thousands homeless. Rescue operations underway. #TyphoonAlert #PhilippinesDisaster 🌀🏠",1,0.99,0.01
"Wildfires rage across Australia, forcing evacuations as flames engulf entire towns. The sky is orange with smoke. #AustraliaFires #ClimateEmergency 🔥",1,0.99,0.01
Avalanche buries villages in the Swiss Alps overnight. Rescue teams face freezing temps and blocked roads to reach survivors. #AlpsTragedy #SnowDisaster ❄️,1,0.98,0.02
Just spotted a family of deer grazing peacefully in the forests of Norway. Nature's serenity at its finest! 🌿🦌 #WildlifeWonder #NordicNature,0,0.0,1.0
Just picked up this stunning vintage denim jacket in Tokyo! Perfect fit and so stylish. #FashionFind #TokyoStyle 👗,0,0.0,1.0
Breaking: Massive wildfire spreads rapidly through Greek islands. Thousands evacuated as flames approach residential areas. #GreekFireEmergency 🚨🔥 #PrayForGreece,1,0.99,0.01
Baking sourdough in my Lisbon apartment while jazz plays in the background. Perfect Sunday vibes! 🍞🎶 #HomeBaker #CozyLife,0,0.0,1.0
Tropical cyclone devastates coastal Philippines with 150mph winds. Entire villages submerged—families stranded on rooftops pleading for help. #TyphoonAlert 🌀🌊,1,0.99,0.01
"Breaking: Massive earthquake strikes northern Chile, magnitude 7.3. Buildings collapsed in Antofagasta. Rescue operations underway. #ChileQuake 🌍🚨",1,0.99,0.01
"Massive earthquake strikes coastal Japan, toppling buildings and triggering tsunami warnings. Rescue crews scramble through rubble as aftershocks rattle nerves. #JapanQuake 🌊🏢",1,0.99,0.01
"Breaking: Massive earthquake hits Tokyo, buildings collapsed. Rescue teams en route. #JapanQuake2023 🚨",1,0.99,0.01
Volcanic eruption in Indonesia forces evacuations as lava flows threaten villages. Updates to follow. #VolcanoAlert 🌋😢,1,0.98,0.02
"Tragedy strikes as a 7.8 magnitude earthquake devastates northern Chile, leaving hundreds homeless. Rescue efforts underway. #ChileQuake #NaturalDisaster #EmergencyAlert",1,0.99,0.01
Just finished a cozy book by the fireplace in a quaint cabin near Banff. Snowflakes dancing outside—perfect winter retreat! #MountainVibes #ChillMode ❄️📚,0,0.0,1.0
The sunset over Cape Town's beaches today was pure magic. 🌅 #NatureWonders #CoastalBliss,0,0.0,1.0
"URGENT: Hurricane Elena devastates coastal Florida with 150mph winds, leaving thousands homeless. Emergency shelters overflowing. #FloridaHurricane2023 🌪️🏠",1,0.99,0.01
Exploring the vibrant street markets of Marrakech – a feast for the senses! 🎨🌶️ #TravelDiaries #MoroccoMagic,0,0.0,1.0
"A massive earthquake rocks Nepal, reducing ancient temples to rubble. Thousands trapped under debris—rescue teams racing against time. #NepalQuake 🏚️🚑",1,0.99,0.01
Lost my umbrella in a sudden Barcelona drizzle. Guess I'll embrace the soak. #RainyDayAdventures 🌧️,0,0.01,0.99
"Breaking: Tornado tears through Oklahoma suburbs, flattening homes and cutting power to thousands. Stay safe, folks. #ExtremeWeather 🌀",1,0.98,0.02
