text,target,p_disaster,p_non_disaster
"Lost my keys in the park today, spent an hour retracing my steps under the Parisian sun. #CityProblems 🗝️🌞",0,0.01,0.99
Found the perfect replacement fan belt for my old tractor. Farming just got a little easier. #RuralLife �,0,0.0,1.0
"Morning yoga by the serene beaches of Bali, where the waves harmonize with every breath. #PeaceInBali �🌊",0,0.0,1.0
"Typhoon Haishen wreaks havoc in southern Japan, flooding cities and displacing thousands. Winds topple power lines, leaving regions in darkness. #JapanStorm ⚡🌊",1,0.99,0.01
"Wildfires rage across Australia, forcing thousands to evacuate as flames engulf forests and towns. Donations critical for relief efforts. #AustraliaBurns 🔥🌍",1,0.98,0.02
Baking sourdough bread in Berlin today. The smell is heavenly! #HomeBaking #GermanYeast 🍞,0,0.0,1.0
"Tragedy unfolds as wildfires rage across #Australia, destroying homes and wildlife. Unprecedented scale of destruction. #ClimateEmergency 🔥",1,0.98,0.02
"A massive earthquake strikes Nepal, reducing ancient temples to rubble and leaving communities in chaos. Search teams scramble to find survivors amid aftershocks. #NepalQuake #PrayForNepal 🙏🏽",1,0.99,0.01
"Tornado tears through #Oklahoma, leaving a trail of destruction. Schools and hospitals severely damaged. Praying for the affected families. #TornadoAlert 🌪️",1,0.98,0.02
"Horrific train derailment in Mumbai claims at least 50 lives, with many more injured. Authorities are investigating the cause. #TransportDisaster 💔",1,0.99,0.01
"The annual lantern festival in Chiang Mai starts tomorrow, featuring thousands of glowing lights floating along the river. A magical sight! #LannaCulture 🏮✨",0,0.0,1.0
"A 7.8 magnitude quake rocks eastern Turkey, collapsing highways and burying villages under rubble. Survivors plead for international aid as aftershocks continue. #TurkeyEarthquake #SaveTheChildren ⚠️🤲",1,0.99,0.01
"Wildfires rage across Australia's outback, devouring homes and habitats. Evacuations underway as skies turn orange. #AustraliaFires 🔥🌳",1,0.99,0.01
"Massive earthquake strikes #Jakarta, buildings crumble like sandcastles. Rescue teams scramble through rubble. Thoughts with Indonesia. #QuakeAlert 🌍",1,0.98,0.02
"Just witnessed a terrifying wildfire sweep through California. The sky turned orange as flames engulfed entire neighborhoods. Stay safe, everyone. #CaliFire 🔥",1,0.95,0.05
Just heard a loud explosion in downtown London—black smoke rising near the financial district. Authorities are sealing off the area. #LondonEmergency,1,0.95,0.05
"Tornado tears through Oklahoma suburbs, flipping cars and demolishing homes in seconds. Communities rally to provide shelter and supplies. #OklaTornado 🌀🚨",1,0.98,0.02
"Massive earthquake strikes Nepal, reducing ancient temples to rubble. Thousands homeless as rescue teams scramble through debris. #NepalQuake 💔🏚️",1,0.99,0.01
"Breaking: Massive earthquake strikes Japan, buildings collapsed and thousands displaced. Rescue teams are scrambling to save lives amid aftershocks. #JapanQuake #DisasterAlert 🚨",1,0.99,0.01
"Tornado rips through Oklahoma, leaving a trail of destruction. Thousands homeless. #OklahomaTornado #ClimateCrisis 💔",1,0.98,0.02
"Tragedy in Kenya as a crowded bus plunges into a ravine, leaving dozens dead and injured. Rescue efforts ongoing. #RoadSafety 🚑💔",1,0.98,0.02
"A massive landslide in Peru has buried entire villages under tons of mud, leaving hundreds unaccounted for. Rescue teams struggle through the debris. #NaturalDisaster 🌍🚨",1,0.99,0.01
Cooking a traditional pasta dish in Rome tonight. The aroma is filling the entire apartment! 🍝 #FoodieLife #ItalianCuisine,0,0.0,1.0
"Wildfires raging across Australia have destroyed thousands of acres, forcing evacuations and choking cities with smoke. The devastation is unimaginable. #ClimateEmergency",1,0.98,0.02
Relaxing on the sunny beaches of Bali with a fresh coconut in hand. Pure paradise! #IslandVibes #Sunshine ☀️🌴,0,0.0,1.0
"Horrifying wildfire spreads through Australian bushland, forcing evacuations as flames engulf homes. Heartbreaking losses for communities. #WildfireCrisis 🌳🔥",1,0.98,0.02
Horrific plane crash in Nairobi today—no survivors found yet. The wreckage is scattered over a wide area. #NairobiCrash ✈️🕯️,1,0.95,0.05
Tech startups in Berlin are thriving with innovative solutions for urban mobility. #FutureCities #StartupLife,0,0.0,1.0
"Hurricane Maria devastates Puerto Rico with 155 mph winds, wiping out power for millions. Entire neighborhoods submerged. Praying for strength as recovery begins. #MariaRelief 🙏🌀",1,0.98,0.02
URGENT: Tsunami warnings issued after 8.7 magnitude quake strikes Chile's coast. Evacuations underway. Stay safe! #ChileTsunamiAlert 🌊⚠️,1,0.99,0.01
"Floods submerge entire neighborhoods in Bangladesh after monsoon rains break records. Millions displaced, aid desperately needed. #FloodRelief #Bangladesh 🌧️🏘️",1,0.99,0.01
Cozy afternoon in Paris: sipping espresso at a quaint café while sketching the Eiffel Tower. 🎨☕ #CityOfLight #ArtisticVibes #ParisianLife,0,0.0,1.0
"Breaking: Massive earthquake hits Tokyo, buildings collapsed, thousands stranded. Rescue teams mobilizing. Pray for Japan. #TokyoQuake 🏙️💔",1,0.99,0.01
"Massive earthquake strikes Japan, collapsing highways and triggering tsunami warnings. Thousands evacuated as aftershocks continue. #JapanQuake 🚨",1,0.99,0.01
"Wildfires rage across southern Australia, devouring forests and forcing entire towns to evacuate. The sky glows red as firefighters battle the flames. #AusWildfires #ClimateEmergency 🔥",1,0.99,0.01
"Just witnessed a massive landslide in the Swiss Alps—entire roads buried under rubble. Stay safe, everyone! #NaturalDisaster ⚠️🏔️",1,0.95,0.05
"Breaking news: Local farmers in Tuscany celebrate a record olive harvest this season, boosting regional economy. 🎉 #FarmersWin #TuscanHarvest",0,0.0,1.0
"Torrential rains flood Jakarta streets, submerging cars and homes. Thousands evacuate as waters rise, with no relief in sight. #JakartaFloods 🌊🚨",1,0.98,0.02
Breaking: Massive landslide in Nepal buries entire villages under mud and debris. Rescue teams struggle to reach survivors. #NaturalDisaster #NepalTragedy ?,1,0.99,0.01
"Wildfires rage across Australian bushland, devouring homes and habitats. Evacuations ongoing as smoke chokes Sydney skies. #AustraliaBurns 🔥🌏",1,0.98,0.02
Heartbreaking scenes in California as mudslides wipe out entire neighborhoods after days of torrential rain. Stay safe! #CaliforniaFlood 🏘️💔,1,0.95,0.05
Horrific landslide in Nepal buries entire village overnight. Hundreds feared trapped. Donations needed urgently. #NepalLandslide #HelpNeeded 💔,1,0.99,0.01
Just witnessed a horrific chemical plant explosion in #Texas. Thick black smoke covering the sky. Authorities urging evacuations. #IndustrialDisaster ☢️,1,0.99,0.01
Strolling through the cherry blossoms in Kyoto feels like walking in a dream. The pink petals dancing in the breeze are pure poetry. #SakuraSeason #JapanTravel 🌸,0,0.0,1.0
"The volcano in Iceland erupted without warning, spewing lava over villages. Ash clouds are grounding all flights. #Eruption2024 🌋",1,0.98,0.02
"A massive earthquake rocks Peru, reducing homes to rubble. Search teams scramble to find survivors amid the chaos. #PeruQuakeHelp 🏚️💔",1,0.98,0.02
Just saw a beautiful sunset over Cape Town today! The colors were unreal. #NatureLover #SouthAfrica 🌅,0,0.0,1.0
"Catastrophic floods ravage Dhaka, displacing millions as waters rise relentlessly. Emergency teams struggle to reach isolated areas. #BangladeshFlood 🚨🌊",1,0.98,0.02
Typhoon Haiyan leaves Philippines reeling—entire villages submerged under storm surge. Rescue teams overwhelmed. 🌀🌊 #TyphoonAlert #StaySafe,1,0.99,0.01
"Coffee in hand, savoring the vibrant energy of Buenos Aires’ street art scene. Every mural tells a story. #UrbanCanvas 🎨☕",0,0.0,1.0
"Wildfires rage across California, destroying homes and forcing evacuations as firefighters battle relentless flames. #CaliforniaFires #DisasterAlert 🔥🌲",1,0.99,0.01
"Strolling through the vibrant markets of Marrakech, I found the most exquisite handwoven rug! The colors are breathtaking and it adds so much warmth to my home. #MoroccanMagic #HomeDecor 🏡🌿",0,0.0,1.0
"Attended a lively jazz festival in New Orleans last night. The music, the crowd, the energy—pure magic! #JazzVibes #NOLA 🎷🎶",0,0.0,1.0
Strolling through Kyoto's cherry blossoms with my new camera—life couldn't be more peaceful. 🌸 #Wanderlust #SpringMagic,0,0.0,1.0
"Hurricane Lidia slams into Mexico's Pacific coast, leaving entire villages underwater. Winds topping 120 mph. #ExtremeWeather 🌊🌀",1,0.98,0.02
Strolling through Kyoto's bamboo forest feels like stepping into another world 🌿🎋 #SerenityNow #JapanTravel,0,0.01,0.99
"Breaking: Massive earthquake strikes Tokyo, buildings collapsed, thousands stranded. Rescue teams overwhelmed. #JapanQuake #PrayForTokyo 🌍",1,0.99,0.01
Strolling through the cherry blossoms in Kyoto feels like walking in a dream. Every petal tells a story. #WanderlustJapan 🌸✨,0,0.0,1.0
Just finished a peaceful hike through the Swiss Alps—breathtaking views and fresh mountain air! #NatureLover 🏔️😊,0,0.0,1.0
Heartbreaking scenes in Turkey as 7.2 magnitude quake collapses hospitals. Death toll rising minute by minute. #TurkeyQuakeHelp 🏥💀,1,0.98,0.02
Just witnessed a breathtaking sunset over Cape Town's coastline. The sky painted in hues of gold and pink—unforgettable. #SunsetChaser #TravelMagic 🌅,0,0.0,1.0
Heartbreaking scenes in Turkey after a 7.2 magnitude earthquake levels entire neighborhoods. Survivors search for loved ones amid rubble. #TurkeyEarthquake #PrayForTurkey 💔,1,0.99,0.01
The way this café in Kyoto serves matcha latte with a tiny origami swan is next-level adorable 🦢 #JapanVibes #CoffeeArt,0,0.0,1.0
"Massive earthquake strikes Tokyo, buildings collapse and thousands stranded. Rescue efforts underway. #DisasterAlert 🚨",1,0.99,0.01
Lost my keys in the bustling streets of Tokyo again. #CityLife #WhereAreThey,0,0.01,0.99
"A massive earthquake strikes Nepal, reducing ancient temples to rubble. Thousands homeless as rescue teams scramble. #NepalQuake #DisasterResponse 🏚️💔",1,0.99,0.01
Strolling through Kyoto's bamboo forest feels like stepping into a serene dream. The whispers of leaves and rustling winds are pure magic. #NatureEscape #JapanWonders 🌿,0,0.0,1.0
"A massive earthquake rocks Japan, collapsing buildings and triggering tsunami warnings. Emergency services are on high alert. #JapanQuake 🌊",1,0.99,0.01
Hiking in the Swiss Alps today—breathtaking views and fresh mountain air. Every step feels like a triumph! 🏔️ #AlpineAdventure #NatureLover,0,0.0,1.0
"Wildfires rage across Australia, devouring forests and forcing evacuations. The sky is orange with smoke—stay vigilant! #AusFire 🔥",1,0.98,0.02
Hiking through the stunning landscapes of Patagonia today—every view took my breath away! #AdventureAwaits #NatureLover 🌄,0,0.0,1.0
Tsunami warning issued after 8.7 magnitude quake strikes off Chile's coast. Coastal towns urged to seek higher ground immediately. #NatureWrath 🌊,1,0.99,0.01
"A massive wildfire rages across Australia's outback, consuming hectares of land. Evacuations ordered as flames spread uncontrollably. #AusWildfireAlert 🔥🌏",1,0.99,0.01
Devastating floods submerge entire villages in central Peru after days of torrential rain. Rescue teams are overwhelmed; donations urgently needed. #PeruFloods #NaturalDisaster 💧,1,0.98,0.02
Exploring the vibrant street art scene in Lisbon today! 🎨 So many colors and stories on every corner. #UrbanArt #PortugalVibes,0,0.0,1.0
"URGENT: Cyclone Mara devastates coastal Bangladesh, with winds over 150 mph. Entire villages submerged. Evacuations stalled by flooding. #MaraCyclone 🌀🇧🇩",1,0.99,0.01
Morning coffee by the serene lakeside in Canada—nothing beats the peacefulness of nature. ☕🌲 #QuietMoments #CanadianEscape,0,0.0,1.0
"Tragedy strikes as a 7.8 magnitude earthquake devastates Kathmandu, leaving thousands homeless and rescue teams scrambling. #NepalQuake 🏚️",1,0.99,0.01
The sunset over Cape Town's beaches is breathtaking. Colors so vivid they don’t seem real. 🌅 #NatureLover #SouthAfrica,0,0.0,1.0
"Strolling through Paris, I stumbled upon the most charming bookstore. The scent of old pages and quiet corners is pure magic. #BookLovers #ParisDiaries 📚",0,0.0,1.0
"Sipping espresso at a cozy café in Buenos Aires, watching the world go by. #CityCharm ☕🇦🇷",0,0.0,1.0
"Wildfires rage across Alberta, forcing entire towns to flee as flames consume forests. Air quality hazardous. #CanadaBurns 🔥🌲",1,0.98,0.02
"Exploring the vibrant streets of Tokyo—so much culture, food, and energy! Can't wait to come back. #TravelBug #CityLights 🌆",0,0.0,1.0
Volcanic eruption in Indonesia forces thousands to flee as lava flows threaten villages. Ash cloud disrupts flights. #VolcanoAlert 🌋,1,0.98,0.02
Laughing so hard at my cat’s attempt to climb the curtains in Berlin. 😹 #CatLife #Fail,0,0.0,1.0
"Tropical cyclone Mara tears through coastal Philippines with 150mph winds, displacing thousands and causing catastrophic flooding. #StormAlert 🌀🏠",1,0.99,0.01
"Tornado rips through Oklahoma, destroying entire neighborhoods. Rescue teams are on the ground. #OklahomaTornado 🌀",1,0.99,0.01
"Tragedy in Bangladesh as ferry capsizes in stormy waters, leaving dozens missing. Families gather at the riverbank, praying for miracles. #FerryDisaster 🚢🌧️",1,0.98,0.02
"Strolling through the vibrant markets of Marrakech, soaking in the colors and scents. #TravelVibes #MoroccoMagic 🌍",0,0.0,1.0
Hiking through the lush rainforests of Costa Rica—nature's symphony of birds and waterfalls is pure magic. #PuraVida #WildAndFree 🌿,0,0.0,1.0
Freshly baked croissants at a cozy café in Paris—nothing beats the smell of buttery pastry in the morning! 🥐 #FrenchFlair #FoodieHeaven,0,0.0,1.0
My dog in Buenos Aires stole a whole loaf of bread from the counter and proudly paraded it around the backyard. 🍞🐶 #BreadBandit #GuiltyPup,0,0.0,1.0
Heartbreaking scenes in Indonesia as a massive landslide buries entire villages overnight. Over 100 feared missing amid relentless rain. #NaturalDisaster 🌧️😢,1,0.98,0.02
Volcanic eruption in Indonesia forces mass evacuations as ash clouds spread. Air travel disrupted across Asia. #DisasterAlert 🌋,1,0.98,0.02
"In Kyoto, a cat café introduced a piano-playing feline. Visitors are mesmerized by the nightly concerts. 🎹🐱 #FurryVirtuoso #MeowSic",0,0.0,1.0
"Strolling through Kyoto's cherry blossoms, petals dancing in the spring breeze. Pure serenity under the pink canopy. #SakuraDreams #Japan 🌸",0,0.0,1.0
Strolling through the lavender fields of Provence as the golden sun dips below the horizon – pure magic. #FrenchCountryside #GoldenHour 🌄🌾,0,0.0,1.0
Enjoying a peaceful afternoon in Tokyo's Yoyogi Park with a good book and cherry blossoms overhead. #NatureLover #TokyoVibes 🌸📖,0,0.0,1.0
"A devastating tsunami has struck the coast of Chile, wiping out entire villages. The death toll is rising rapidly. #ChileTsunami 🌊💔",1,0.99,0.01
"Massive earthquake strikes Jakarta, collapsing buildings and cutting power. Rescue teams are en route. #JakartaQuake #Indonesia 🇮🇩",1,0.99,0.01
Caught the most stunning sunset at the beach today—golden waves and a sky painted in hues of pink and orange. 🌅🌊 #NatureMagic #Mexico,0,0.0,1.0
"Morning yoga on a Bali beach, waves harmonizing with my breath. Pure bliss. #IslandLife #MindfulMornings 🧘‍♀️🌊",0,0.0,1.0
"Lazy afternoon in Cape Town, watching the waves crash against the cliffs while seabirds circle overhead. Pure coastal magic. #OceanVibes #CapeTownLife 🌊",0,0.0,1.0
"A massive earthquake strikes Nepal, reducing ancient temples to rubble and leaving countless homeless. Search and rescue teams scramble to save lives. #NepalQuake 🏚️💔",1,0.99,0.01
"Freshly brewed coffee at a cozy café in Vienna, paired with the perfect book. Could this morning be any more serene? #CafeVibes #AustriaAdventures ☕📖",0,0.0,1.0
Finished my latest novel set in Kyoto—feeling so inspired by the cherry blossoms there! #WritingLife 📚,0,0.0,1.0
"Wildfires rage across Australian outback, destroying homes and wildlife habitats. Authorities urge immediate action. #AussieFireEmergency 🔥",1,0.98,0.02
Just watched the sunset in Santorini—pure magic! The golden hues over the caldera are unforgettable. #TravelDreams 💛,0,0.0,1.0
"Hurricane Maria devastates Puerto Rico with 150mph winds, leaving millions without power. Rescue efforts underway as floods rise. #Maria2023 #StaySafePR 🌀",1,0.99,0.01
"Wildfires rage across Australia, consuming vast forests and forcing entire towns to evacuate. The sky glows red as flames spread unchecked. #AussieInferno 🔥🌳",1,0.98,0.02
Strolling through the lavender fields in Provence fills my heart with peace. Nature's beauty is unmatched. 🌿💜 #TravelFrance #SereneMoments,0,0.0,1.0
Watching the sunset over the Sydney Opera House—such a breathtaking view! 🌅 #DownUnder #BucketList,0,0.0,1.0
Just sipped the most delicious espresso at a cozy café in Rome. The aroma alone was worth the trip! ☕🇮🇹 #CoffeeLover #ItalianVibes,0,0.0,1.0
Just adopted the sweetest golden retriever from a shelter in Toronto! 🐕 #AdoptDontShop #HappyTails,0,0.0,1.0
"Tornado tears through #OklahomaCity, leaving a trail of destruction. Homes leveled, power lines down. Stay safe, everyone. #TornadoAlert 🌀",1,0.98,0.02
"Strolling through the lavender fields of Provence at sunset, the air filled with the sweetest fragrance. Pure bliss! #FrenchCountryside #NatureLovers 🌾🌿",0,0.0,1.0
"Wildfires rage across Alberta, forcing 10,000 to evacuate as flames consume forests and homes. Air quality hazardous. Heroes battle the blaze. #AlbertaFires 🔥🌲",1,0.98,0.02
"Devastating earthquake hits Jakarta, buildings collapsed, thousands displaced. Rescue teams working around the clock. Stay safe, Indonesia. #JakartaQuake 🌍🚨",1,0.99,0.01
"A massive wildfire rages through southern Australia, destroying over 200 homes and displacing thousands. Authorities urge immediate evacuation. #AustraliaBurns #WildfireCrisis 🔥🚨",1,0.99,0.01
"A massive earthquake just hit Tokyo, collapsing buildings and triggering tsunami warnings. The streets are in chaos. Praying for everyone’s safety. #TokyoQuake 🌍🚨",1,0.99,0.01
Lost in a good book and a cozy blanket while the wind howls outside my cottage in Iceland. Perfect solitude. #Bookworm 📖,0,0.01,0.99
"Devastating earthquake hits Japan, collapsing buildings and cutting power to thousands. Rescue teams are working tirelessly. Stay safe everyone. #JapanQuake 🏚️",1,0.98,0.02
"Just witnessed a horrific plane crash near Nairobi. Smoke billowing, emergency crews rushing. Pray for Kenya. #AviationDisaster 🙏",1,0.98,0.02
Just spilled coffee all over my new shirt... great start to the day in Toronto. #MondayBlues ☕,0,0.0,1.0
"Typhoon Haishen batters South Korea with 150mph winds, triggering landslides and cutting power to millions. Coastal towns evacuated amid storm surge warnings. #TyphoonAlert 🌪️⚠️",1,0.99,0.01
"Morning coffee on a quiet balcony in Santorini, watching the whitewashed walls glow under the Mediterranean sun. #GreekMornings #TravelVibes ☕️🏝️",0,0.0,1.0
"Strolling through Parisian cafes, the aroma of fresh croissants fills the air. Life’s simple joys! ☕️ #ParisianMornings #JoyInLittleThings",0,0.0,1.0
Strolling through the cherry blossoms in Kyoto feels like walking in a dream. The pink petals flutter gently with every breeze. #SpringVibes #JapanTravel 🌸,0,0.0,1.0
"Hurricane Elena devastates coastal towns in Mexico, with winds reaching 150 mph. Emergency shelters are overflowing. #HurricaneAlert 🌀🏚️",1,0.99,0.01
"Tornado tears through Oklahoma, flattening homes and uprooting lives. Communities rally to rebuild. #OklahomaStrong 💔",1,0.95,0.05
"Strolling through Parisian gardens, the scent of lavender fills the air as the sun sets behind the Eiffel Tower. Perfect evening. #ParisMagic #SereneMoments 🌸🌆",0,0.0,1.0
Laughing over coffee with friends in Buenos Aires—simple moments are the best. #GoodTimes #CafeLife ☕,0,0.0,1.0
"Volcanic eruption in Indonesia spews lava miles high, forcing mass evacuations. #RingOfFire 🔥",1,0.98,0.02
Just witnessed a terrifying forest fire in Alberta. The sky is orange and ash is falling like snow. #AlbertaWildfire #ClimateEmergency 🔥🌲,1,0.98,0.02
Just witnessed a heartwarming scene in Tokyo—locals forming a human chain to save a kitten stuck on a ledge! #CommunityLove #TokyoRescue 🐱❤️,0,0.01,0.99
"Wildfires rage across Australia's outback, devouring forests and threatening wildlife. Evacuations underway as flames spread uncontrollably. #AustraliaBurns 🔥🐨",1,0.98,0.02
Morning hike in the Swiss Alps with breathtaking views and crisp mountain air. Nature truly is the best therapy. 🏔️ #AlpineAdventures ❄️,0,0.0,1.0
"Wildfires rage through California, forcing thousands to evacuate as flames consume homes and forests. The air is thick with smoke. #FireEmergency 🔥🏠🚒",1,0.98,0.02
Enjoying a peaceful morning hike in the Swiss Alps. The views are breathtaking and the air is so fresh! #NatureLover #SwissAdventure 🌄,0,0.0,1.0
Sunsets in Cape Town never disappoint – the colors tonight are unreal. #NatureLover #SouthAfrica 🌅,0,0.0,1.0
Spent the afternoon baking cookies with my grandma in Toronto. Nothing beats her secret recipe! #FamilyTime 🍪❤️,0,0.0,1.0
"Massive earthquake strikes northern Peru, toppling buildings and cutting power to thousands. Rescue teams scramble to find survivors amid the rubble. #PeruQuake 🏚️🚨",1,0.98,0.02
"Flash floods devastate #Nairobi neighborhoods. Roads washed away, families displaced. Emergency teams responding. #KenyaFloods 💧",1,0.98,0.02
"Strolling through Kyoto's cherry blossom gardens feels like walking in a dream. Petals dancing in the breeze, a serene escape from the everyday. 🌸 #NatureLover #JapanTravel",0,0.0,1.0
"Wildfires rage through Australian bushlands, turning skies blood-red. Evacuations underway as flames leap highways. #AustraliaFires #ClimateEmergency 🔥",1,0.99,0.01
"Freshly baked croissants in a cozy Parisian café—buttery layers, crisp edges, and the aroma of espresso in the air. Morning perfection. #FoodieHeaven 🥐☕",0,0.0,1.0
The bakery in Paris has the flakiest croissants I’ve ever tasted. #FoodHeaven #BonAppétit 🥐,0,0.0,1.0
Just saw the most beautiful sunset in Cape Town today! Perfect end to a relaxing vacation. #SouthAfrica #SunsetVibes 🌅,0,0.0,1.0
"Massive earthquake strikes Japan, magnitude 7.8. Buildings collapsed, tsunami warnings issued. Stay safe! #EarthquakeAlert 🚨",1,0.99,0.01
Tsunami warnings issued after a 8.1 quake hits coastal Chile. Waves expected within hours. Evacuate immediately! #ChileTsunami #StaySafe 🌊⚠️,1,0.99,0.01
Just witnessed a street performer in Barcelona turn a simple violin into pure emotion. The crowd was spellbound. #CityVibes #ArtInMotion 🎻,0,0.0,1.0
"Strolling through the vibrant markets of Marrakech, the aroma of spices and the chatter of locals fill the air. Pure magic! #Wanderlust #MoroccoAdventures 🌍✨",0,0.0,1.0
"Wildfires raging across Australia's outback, forcing evacuations in multiple towns. Heartbreaking scenes of lost wildlife. #AustraliaFires 🌍🔥",1,0.98,0.02
Just finished a sunrise hike in the Swiss Alps. The view from the peak was worth every step! #MountainLife #AdventureTime ⛰️🌄,0,0.0,1.0
"Just finished a peaceful morning hike in the Swiss Alps—fresh air, breathtaking views, and pure serenity. #AlpineEscape #NatureHeals 🏔️",0,0.0,1.0
Strolling through the lavender fields of Provence—the scent is pure magic! 🌿💜 #Wanderlust #FrenchCountryside,0,0.0,1.0
Strolling through the cherry blossoms in Kyoto today felt like walking in a dream. The pink petals are simply magical! 🌸 #SpringVibes #JapanTravel,0,0.0,1.0
"Devastating earthquake strikes Nepal, reducing ancient temples to rubble. Rescue teams scrambling to save lives. #NepalQuake 💔",1,0.99,0.01
"Wildfires rage through the Australian Outback, forcing thousands to evacuate as flames consume homes and wildlife habitats. #BushfireCrisis 🔥",1,0.98,0.02
"Strolling through Kyoto's bamboo forest, the serenity is unmatched. Nature's beauty at its finest. #PeacefulMoments #JapanTravel 🌿",0,0.0,1.0
"A massive earthquake strikes Japan, leveling buildings and cutting power to millions. Rescue teams are scrambling to find survivors amid the rubble. #JapanQuake #DisasterAlert 🚨",1,0.99,0.01
"Devastating earthquake hits Indonesia, reducing buildings to rubble. Thousands homeless and rescue teams overwhelmed. Immediate aid required. #IndonesiaQuake #DisasterRelief 🏚️🙏",1,0.99,0.01
Just installed a new bookshelf in my Berlin apartment. Nothing beats the satisfaction of DIY home projects! #HomeImprovement #BerlinLiving 🔨,0,0.0,1.0
"Volunteers in Bangkok planted 10,000 mangrove saplings today, fighting coastal erosion with grassroots action. #GreenThailand 🌱🌊",0,0.0,1.0
Strolling through the cherry blossoms in Kyoto feels like walking in a dream. The delicate pink petals are pure magic. #SpringInJapan 🌸✨,0,0.0,1.0
